{
  "format": "SWLS_USER_FEEDBACK",
  "version": "1.0-beta",
  "article_id": "A000001",
  "submitted_at": "2026-07-19",
  "adoption": "partial",
  "adopted_targets": [
    "seo_title",
    "introduction"
  ],
  "rating": 4,
  "tags": [
    "TITLE_GOOD",
    "INTRO_GOOD"
  ],
  "comment": "タイトルと導入を採用。FAQは見送った。",
  "manual_edits": "断定表現を1箇所弱めた。"
}
